[
  {
    "body_md": "Four recommended FOCUS-defined properties in SKU Price Details record the model behind a charge: the developer that created it, the model family, the model identifier as billed, and the version. Developer, family, and version read the same way whether the model is bought from its developer or served by a cloud provider; the model identifier is recorded as each provider bills it.\n\n**Why it matters.** This is the piece that makes multi-provider AI spend comparable. Without it, an organization can total what it spent on models last quarter but cannot break that down by model without provider-specific parsing.\n\n- The properties are `ModelDeveloper`, `ModelFamily`, `ModelId`, and `ModelVersion`.\n- `ModelId` is the identifier as it appears in billing and can differ between providers selling the same model; family and version are as the model developer defines them.\n- No columns are added and existing requirements are unchanged, so the change is additive for every data generator. Including these properties is recommended rather than required, so a conformant dataset can omit them.\n- A worked example covers a model bought directly from its developer and the same model served by a cloud provider as its own service. In the second, the service provider and the model developer are different companies, and no existing participating-entity column names the developer.\n- In the worked examples, input and output tokens are separate SKUs with their own meters; the token direction property below labels them on the price whatever the provider calls the meter.",
    "bucket": "done",
    "identifiers": [
      "ModelDeveloper",
      "ModelFamily",
      "ModelId",
      "ModelVersion"
    ],
    "kind": "ai-capability",
    "labels": [
      "In the working draft",
      "FR 2018",
      "PR 2442"
    ],
    "links": [
      "https://github.com/FinOps-Open-Cost-and-Usage-Spec/FOCUS_Spec/issues/2018",
      "https://github.com/FinOps-Open-Cost-and-Usage-Spec/FOCUS_Spec/pull/2442"
    ],
    "provenance": {
      "document": "focus-1-5-for-ai",
      "license": "CC-BY-4.0",
      "section": "theme-ai",
      "source_url": "https://www.tokeneconomics.com/projects/what-1-5-does-for-ai-cost-and-what-it-does-not/"
    },
    "slug": "fr-2018",
    "title": "Cost data can name the AI model and who built it."
  },
  {
    "body_md": "Two recommended FOCUS-defined properties label token prices: how the tokens interacted with a prompt cache, and whether they went into the model or came out of it. They normalize cache and token meter names that differ from one provider to the next.\n\n**Why it matters.** Cached input tokens often cost a fraction of uncached ones at the same provider; in the specification's worked example, a cache read costs a tenth of the input price. Without a common label, separating a fall in cache hit rate from a rise in traffic means matching each provider's meter names by hand, so one of the most actionable AI optimization levers is hard to track across providers.\n\n- `TokenCacheAction` takes \"Uncached\", \"Read\", \"Write\", or \"Other\" on prices that meter only tokens consumed from a request. `TokenDirection` takes \"Input\" or \"Output\" on prices that meter tokens in one direction. A price that bills several kinds of tokens on one meter omits the property that would misdescribe them.\n- They are the first FOCUS-defined SKU Price Details properties with a fixed set of allowed values. Including them is recommended rather than required.\n- A cached token counted on a \"Read\" or \"Write\" row is not counted again on another row, so token totals do not double count.\n- Reasoning tokens metered separately carry \"Output\". Modality, reasoning effort, cache retention duration, and context window size are not values of either property.\n- A worked example shows two providers that meter caching differently: one charges to write to the cache, the other charges to keep content in it. Charges for keeping cached content carry neither property.\n- Two example queries join the Resource Usage supported feature: cache hit rate for token-metered SKUs by model, and the ratio of input to output tokens by model.\n- The glossary adds AI model, prompt cache, and token, and separates a token as a unit of measure from a token as a store of value.",
    "bucket": "done",
    "identifiers": [
      "TokenCacheAction",
      "TokenDirection"
    ],
    "kind": "ai-capability",
    "labels": [
      "In the working draft",
      "FR 2099",
      "PR 2606"
    ],
    "links": [
      "https://github.com/FinOps-Open-Cost-and-Usage-Spec/FOCUS_Spec/issues/2099",
      "https://github.com/FinOps-Open-Cost-and-Usage-Spec/FOCUS_Spec/pull/2606"
    ],
    "provenance": {
      "document": "focus-1-5-for-ai",
      "license": "CC-BY-4.0",
      "section": "theme-ai",
      "source_url": "https://www.tokeneconomics.com/projects/what-1-5-does-for-ai-cost-and-what-it-does-not/"
    },
    "slug": "fr-2099",
    "title": "Cached tokens separate from uncached ones, and input from output, on the price itself."
  },
  {
    "body_md": "Six worked scenarios, each with sample data, showing how token billing maps onto existing FOCUS columns, plus an AI Model Billing supported feature with example queries. No columns are added: FOCUS already has the columns to carry token consumption, and the gap these close is applying them the same way.\n\nevery single one has a different data formatA FinOps practitioner managing 20-plus AI providers\n\n**Why it matters.** When FinOps Practitioners cannot tell how existing columns apply to AI billing, every provider gets normalized differently. Shared examples give data generators and practitioners one reference for the arrangements they meet most.\n\n#### The scenarios\n\n- A model developer billing per token, directly.\n- Several models on one invoice, each priced separately.\n- Cached tokens bought through a cloud provider's marketplace, where the model developer is the seller and the cloud provider hosts and invoices.\n- A cloud provider billing for its own service that serves a third-party model.\n- A prepayment drawn down by token usage, the only scenario with committed-price usage rows.\n- A multi-model invoice through a cloud marketplace, with cache meters.\n\n#### How the rows are built\n\nConsumed Quantity and Consumed Unit carry the raw token count; Pricing Quantity and Pricing Unit carry the same consumption in the block the provider prices against, such as per million tokens. SKU ID identifies the priced model offering and SKU Meter the token type. The rows use the model identity and token properties, and the requester columns where a principal or credential applies. The AI Model Billing supported feature adds two queries: effective cost per million tokens by SKU, token direction, and cache action, and token consumption over time.\n\nRequested by NatWest, SLB, UK Government Digital Service, Shutterstock, Syngenta, Anglepoint, AWS, and the FinOps Foundation.",
    "bucket": "review",
    "identifiers": [],
    "kind": "ai-capability",
    "labels": [
      "In final review",
      "FR 1941",
      "PR 2605"
    ],
    "links": [
      "https://github.com/FinOps-Open-Cost-and-Usage-Spec/FOCUS_Spec/issues/1941",
      "https://github.com/FinOps-Open-Cost-and-Usage-Spec/FOCUS_Spec/pull/2605"
    ],
    "provenance": {
      "document": "focus-1-5-for-ai",
      "license": "CC-BY-4.0",
      "section": "theme-ai",
      "source_url": "https://www.tokeneconomics.com/projects/what-1-5-does-for-ai-cost-and-what-it-does-not/"
    },
    "slug": "fr-1941",
    "title": "Worked examples for mapping AI model billing into FOCUS."
  },
  {
    "body_md": "Three new Cost and Usage columns. Principal ID identifies the user, service account, or other identity granted access. Credential ID identifies the credential presented on the request, such as an API key or a session. Requester Details carries the attributes a provider publishes for each, such as a display name, type, and email address.\n\n**Why it matters.** As spend shifts from provisioned infrastructure to per-call model invocations, the question changes from which account owns an instance to which developer, team, or automated agent used the tokens. These columns answer it inside billing data rather than by joining to observability.\n\n- Principal ID is the attribution dimension: grouping by it combines a user's or workload's charges however each request was credentialed. Credential ID is the audit dimension: it isolates the spend driven by one key or session.\n- Neither ID column may contain a value that authenticates a request, such as the key string itself, and each is empty when the provider publishes no identifier.\n- Neither column identifies who benefits from a charge. A shared workload, a gateway, or an embedded assistant can act for people who never appear in billing data.\n- An agent appears when it acts under its own service account or key. Further levels, such as a delegating identity or a client application, can be carried as custom entries in Requester Details.\n- A worked example walks through 14 scenarios, including a generative AI API key owned by a user, a key issued to a service account, a pipeline that opens a new session on every run, seat-based SaaS with per-token AI usage, and a provider whose keys are themselves the identity.\n- The columns are `PrincipalId`, `CredentialId`, and `RequesterDetails`. All three are Conditional, governed by a new operating model condition for requester attribution.",
    "bucket": "done",
    "identifiers": [
      "CredentialId",
      "PrincipalId",
      "RequesterDetails"
    ],
    "kind": "ai-capability",
    "labels": [
      "In the working draft",
      "FR 2358",
      "PR 2360, Principal ID",
      "PR 2553, Credential ID and Requester Details"
    ],
    "links": [
      "https://github.com/FinOps-Open-Cost-and-Usage-Spec/FOCUS_Spec/issues/2358",